<?xml version="1.0" encoding="UTF-8" ?>
<Users xmlns="http://jd02_09.krivenkova.it.by"
       xmlns:xsi="http://www.w3.org/2001/XMLSchema-instance"
       xsi:schemaLocation="http://jd02_09.krivenkova.it.by} Schema.xsd">
        <User>
            <Login>Kira</Login>
            <Password>moon</Password>
            <Surname>Афонко</Surname>
            <Name>Кирилл</Name>
            <Patronymic>Васильевич</Patronymic>
            <Email>kirAf@mail.ru</Email>
            <Routes>
                <Route>
                    <DepTown>Минск</DepTown>
                    <DepDate>12.08.2016</DepDate>
                    <DepTime>18:30</DepTime>
                    <ArrTown>Москва</ArrTown>
                    <Price currency="$$$$">15.2</Price>
                    <NumTickets>2</NumTickets>
                </Route>
                <Route>
                    <DepTown>Таллин</DepTown>
                    <DepDate >24.05.2017</DepDate>
                    <DepTime>06:30</DepTime>
                    <ArrTown>Берлин</ArrTown>
                    <Price currency="$$$$">72.6</Price>
                    <NumTickets>1</NumTickets>
                </Route>
            </Routes>
        </User>
        <User>
            <Login>lemon</Login>
            <Password>tark</Password>
            <Surname>Самохин</Surname>
            <Name>Максим</Name>
            <Patronymic>Николаевич</Patronymic>
            <Email>Samoh@mail.ru</Email>
            <Routes>
                <Route>
                    <DepTown>Белосток</DepTown>
                    <DepDate>08.04.2017</DepDate>
                    <DepTime>12:15</DepTime>
                    <ArrTown>Львов</ArrTown>
                    <Price currency="$$$$">50.3</Price>
                    <NumTickets>1</NumTickets>
                </Route>
            </Routes>
        </User>
    </Users>

